Adventure,Date,Name,Description,,
ℶ1,17/04/21,Dragon King Oriental Buffet,"Matthew went to NT's Best Rated Place, Dragon King Oriental Buffet, famed for its 0 hygiene rating in every category. Sadly, he is no longer with us, RIP.",,
ℶ2,11/05/21,Golden Pool,"James wanted food, but got served diahorrea instead.",,
ℶ3,24/05/21,Trotter Towers,"Matthew went on a brief quest to find the fabled Trotter Towers from Only Fools and Horses.",,
ℶ4,24/05/21,"Hanwell, Southall and Iver the Engine","After walking to Hanwell to see some family history, Matthew faced his fears of Southall and went on a little excursion to the amusingly-named Iver.",,
ℶ5,24/05/21,The Triple Train Extravaganza,"Arriving Shortly",,
ℶ6,27/05/21,Hole-in-Rum,"Arriving Shortly",,
ℶ7,31/05/21,"SOME OF YOU MAY THINK MY TONE IS INAPPROPRIATE","Matthew and Freya took the Slowverground from Stratford to Richmond, before meeting every under 30-year-old in London in Twickenham, before listening to the Twickenham station manager explode with rage.",,
